metadata,question,answer,ground_truths,keywords,answer_correctness,passed
"{'id': 1, 'scene': 'business_consulting', 'source': 'https://github.com/sparticleinc/ASEED/blob/main/datasets/business_consulting.csv', 'language': 'ru'}",ycloud - что это?,"**YCloud** - это ведущий поставщик услуг по работе с бизнесом в WhatsApp, который помогает компаниям расширить свои возможности, используя WhatsApp в качестве платформы для маркетинга, продаж и обслуживания клиентов. YCloud предлагает разнообразные продукты и услуги, позволяющие использовать высокий уровень вовлеченности пользователей в WhatsApp для создания персонализированных маркетинговых кампаний, продаж и поддержки клиентов. Основанная в Сингапуре, компания YCloud охватывает более 100 стран и территорий, предоставляя многоязычные услуги и поддержку как для малых, так и для крупных предприятий.

**YCloud** предлагает ряд продуктов и инструментов для эффективного использования WhatsApp в бизнесе. Среди них:
- **API WhatsApp**: позволяет разработчикам легко интегрировать WhatsApp Business в системы, используя популярные языки программирования.
- **Кампании**: позволяют привлекать клиентов через интерактивные мессенджеры и загружать контакты для создания персонализированных маркетинговых сообщений.
- **Боты**: помогают взаимодействовать с клиентами через чатботов на WhatsApp.
- **Инбокс**: предоставляет инструмент для общения с целевой аудиторией и предоставления качественного сервиса.
- **Инструменты роста**: помогают быстро наращивать список контактов через WhatsApp.

Таким образом, **YCloud** представляет собой инновационную платформу, помогающую бизнесам использовать популярное приложение для мессенджеров WhatsApp в различных аспектах своей деятельности, от маркетинга и продаж до обслуживания клиентов, что способствует росту и эффективности бизнеса.","['YCloud - это набор открытых компонентов пользовательского интерфейса, разработанный компанией Yonyou FED на основе knockoutjs, который в основном предназначен для предприятий и веб-приложений на ПК. YCloud также является ведущим поставщиком услуг WhatsApp Business, который стремится помогать предприятиям развивать свой бизнес через WhatsApp - одно из самых популярных в мире приложений для общения.']",['WhatsApp||knockoutjs'],0.5122204221947567,True
"{'id': 2, 'scene': 'business_consulting', 'source': 'https://github.com/sparticleinc/ASEED/blob/main/datasets/business_consulting.csv', 'language': 'ru'}","""Telegram"" - это российская компания?","""Telegram"" - это интересный случай, который вызывает некоторые затруднения в определении своего принадлежания к определенной стране. Несмотря на то, что основатель мессенджера Telegram, Павел Дуров, ранее заявлял, что у компании нет офисов, серверов и юридических лиц в России, и было отмечено, что Telegram не является российским проектом, есть некоторые связи с Россией.

Например, в поисковых результатах говорится, что в 2013 году юридические лица Telegram FZ LLC и Telegram Messenger Inc. были зарегистрированы в Лондоне, Великобритания, но также было зарегистрировано третье юридическое лицо Telegram Messenger LLP в Великобритании. Кроме того, российская компания ""ВТБ-капитал"" вложила средства в облигации Telegram, упоминание о создании мессенджера Telegram в 2013 году братьями Николаем и Павлом Дуровыми .

Таким образом, хотя Telegram был создан российскими братьями и существуют связи с Россией, основная штаб-квартира и регистрация компании Telegram находятся в других странах, таких как Великобритания и Дубай. Это создает некоторые сложности в определении принадлежности Telegram к определенной стране.","['Telegram был основан братьями Николаем и Павлом Дуровыми в 2013 году. Они являются основателями крупнейшей российской социальной сети VKontakte. Однако компания Telegram не расположена на территории России. В настоящее время команда разработчиков Telegram находится в Дубае, Объединенные Арабские Эмираты. Издателем мобильного приложения Telegram является Telegram FZ-LLC, зарегистрированная организация в Объединенных Арабских Эмиратах. Таким образом, хотя основатели являются россиянами, Telegram не является российской компанией.']",['Дубае||не является||Нет||No||不是'],0.7201671352945472,False
"{'id': 3, 'scene': 'business_consulting', 'source': 'https://github.com/sparticleinc/ASEED/blob/main/datasets/business_consulting.csv', 'language': 'zh_tw'}",紫金的銷售收入,"根据最新的信息，紫金矿业在不同时间段的销售收入有所变化。在2023年，紫金矿业的销售收入为2934.03亿元，同比增长8.54%。而在过去的一季度，塞尔维亚紫金铜业实现的销售收入达到2.22亿美元，同比增长87.39%。这些数字显示了紫金矿业在不同领域和不同时间段内的销售表现。

紫金矿业的销售收入主要来自其业务的多个方面，例如黄金、铜等矿产。具体地，在2023年，黄金业务销售收入占了营业收入的42.09%，而铜业务的销售收入占了营业总收入的19.30%。这表明了紫金矿业在黄金和铜业务上的销售额较为显著。

此外，紫金矿业在努力推进绿色矿山建设的同时，也积极参与清洁能源项目的开发，如光伏、风电和水电等项目。通过利用矿山周边资源，公司在2021年推动了清洁电力发电项目，达到的二氧化碳减排量达11.63万吨。这展示了紫金矿业在可持续发展方面的努力。",['紫金礦業2023年的營業收入約為2934.03億元，同比增長8.54%。'],['2934'],0.5775395255549186,True
"{'id': 4, 'scene': 'business_consulting', 'source': 'https://github.com/sparticleinc/ASEED/blob/main/datasets/business_consulting.csv', 'language': 'ru'}",Что за компания Vyro AI?,"**Vyro AI** - это компания, которая занимается разработкой инновационных инструментов для создания контента на основе искусственного интеллекта и машинного обучения. Они представляют собой платформу, которая помогает пользователям выражать свою креативность через создание контента с помощью AI. Компания Vyro AI ориентирована на развитие инструментов для фото-редактирования и создания контента, с целью улучшить процесс создания и сделать его более доступным и простым. 

**Особенности:**
- **Создание контента:** Vyro AI использует технологии искусственного интеллекта для улучшения процесса создания и оптимизации маркетинговых кампаний.
- **Инструменты AI для редактирования контента:** Платформа предлагает инструменты AI для создания и улучшения маркетингового контента.
- **Данные и аналитика:** Vyro AI предлагает данные-driven insights для повышения эффективности маркетинговых стратегий.

Компания Vyro AI активно развивает инструменты для создания контента и фото-редактирования, сосредотачиваясь на технологиях искусственного интеллекта. Имея значительную пользовательскую базу, преимущественно в регионах Азии, таких как Пакистан, Индия, Бангладеш и Китай, Vyro AI планирует расширить свое присутствие на другие рынки и сосредоточиться на предоставлении высококачественных функций для редактирования фотографий. 

Также стоит отметить, что компания Vyro AI активно усовершенствует свои продукты и стремится развивать передовые технологии обработки изображений и мобильные приложения для фото-редактирования.","['Vyro AI - это компания, специализирующаяся на разработке инструментов для творчества на основе искусственного интеллекта и машинного обучения. Согласно информации на их официальном сайте:\n\nVyro разработала более 15 продуктов с общим количеством загрузок более 150 миллионов раз и ежедневной активностью более 800 тысяч пользователей.\nОсновные продукты компании включают AI генератор изображений Imagine, редактор фотографий на основе искусственного интеллекта PhotoShot и т. д.\nКоманда Vyro специализируется на применении передовых технологий генерации AI и стремится предоставлять пользователям инновационные инструменты для творчества.\nКомпания была основана в Пакистане и является многообразной и инновационной технологической компанией на местном рынке.\n\nТаким образом, Vyro AI - это технологическая компания, специализирующаяся на разработке творческих инструментов на основе генеративного искусственного интеллекта, с сильной технической базой и линейкой продуктов в области контентного творчества.']","['Искусственный интеллект', 'изображений']",0.6765908220681345,False
"{'id': 5, 'scene': 'business_consulting', 'source': 'https://github.com/sparticleinc/ASEED/blob/main/datasets/business_consulting.csv', 'language': 'ko'}",В какие еще компании инвестировали основатели Perplexity?,"Основатели Perplexity AI инвестировали в несколько других компаний. Согласно предоставленным данным, ключевые основатели Perplexity включают в себя CEO Аравинда Сриниваса, бывшего аспиранта в Университете Беркли, который внес свой вклад в революционные исследования в области искусственного интеллекта в таких организациях, как DeepMind, Google и OpenAI; CTO Дениса Яратса, бывшего аспиранта в Нью-Йоркском университете, сотрудника исследовательского отдела Meta AI и руководителя команды Quora по рейтингу и машинному обучению; Главного стратега Джонни Хо, ранее работавшего на Quora и в Tower Research Capital, а также бывшего Чемпиона Мира по  Информатике 2012 года и призером по ACM-ICPC (олимпиадам и студенческим соревнованиям по компьютерным наукам); и Президента Энди Конвина.

Однако, в предоставленных данных нет информации о том, что основатели Perplexity инвестировали в другие компании. Из имеющихся сведений следует, что основатели Perplexity сами были объектами инвестиций, а не инвесторами в другие компании.","['Аравинд Сринивас инвестировал в компании Eleven Labs и Pika. Он полюбил эти компании за то, что они делают, и его личная мотивация для инвестиций не связана с финансовой отдачей, а скорее с его увлечением тем, что они делают.']",['Eleven Labs||Pika'],0.5171771163134097,False
"{'id': 6, 'scene': 'business_consulting', 'source': 'https://github.com/sparticleinc/ASEED/blob/main/datasets/business_consulting.csv', 'language': 'zh_cn'}",虎门大桥过路费多少钱？,"虎门大桥的过路费根据不同车型而有所不同。根据相关报道，普通车辆在虎门大桥通行时需要支付的过路费在区间为10元至180元。此收费分段制度适用于从摩托车到21吨以上货车等各种车型，覆盖了不同类型的车辆。另外，关于南沙大桥（虎门二桥）的收费标准，标准车型客车走完虎门二桥全程需要支付42元。

总体来说，虎门大桥的过路费随着车型的不同而区间变化，普通车型的费用大致在10元至180元之间，相较于虎门二桥的42元。",['虎门大桥的过路费为每车次收费40元'],['40'],0.6126006316708623,False
"{'id': 7, 'scene': 'business_consulting', 'source': 'https://github.com/sparticleinc/ASEED/blob/main/datasets/business_consulting.csv', 'language': 'en'}",How did Musk earn the first bucket of gold in his life?,"Elon Musk earned his first significant amount of money through the sale of his company PayPal to eBay. After co-founding Zip2 and X.com, which later transformed into PayPal, Musk made hundreds of millions of dollars from the sale to eBay. This successful transaction provided him with the financial resources to pursue his ventures in electric cars and space technology, leading to the establishment of Tesla and SpaceX, which have since made a profound impact on the business world. 

Musk's journey highlights the importance of leveraging his entrepreneurial skills and innovative ideas to create successful businesses that have reshaped industries. His ability to recognize emerging markets and combine software engineering with business acumen played a crucial role in his early career success, setting the foundation for his later achievements with Tesla and SpaceX.","['Elon Musk earned his first significant fortune from the sale of his web software company, Zip2. Musk and his brother Kimbal founded Zip2 in 1995. The company, which provided an online city guide platform, was quite successful and was purchased by Compaq in 1999 for more than $300 million. From this sale, Musk received around $22 million for his 7% share']",['Zip2'],0.5262645459234805,True
"{'id': 8, 'scene': 'business_consulting', 'source': 'https://github.com/sparticleinc/ASEED/blob/main/datasets/business_consulting.csv', 'language': 'zh_tw'}",iask.ai 2024年3月的訪問量,"根據2024年3月的數據，iask.ai 網站在該月總共接收了約5.46百萬次訪問。此外，iask.ai 在3月份的平均訪問時間為20分53秒，每個訪問的頁數為1.45頁，跳出率為73.1%。相較於前一個月，iask.ai 的訪問量增加了約12.57%。這些數據顯示了該網站在訪問量和用戶參與度方面的表現情況。

總結來說，根據2024年3月的數據，iask.ai 在該月獲得了約5.46百萬次訪問，平均訪問時間為20分53秒，每個訪問的頁數為1.45頁，跳出率為73.1%，並且相較於前一個月，訪問量有了約12.57%的增長。",['iAsk.Ai的2024年3月訪問量為3.3百萬。'],['3.3||3.4'],0.5543725234051776,False
"{'id': 9, 'scene': 'business_consulting', 'source': 'https://github.com/sparticleinc/ASEED/blob/main/datasets/business_consulting.csv', 'language': 'ru'}",Monica.im в 2023 году имеет сколько пользователей?,"Из предоставленных данных не ясно, сколько пользователей имеет Monica.im в 2023 году, поскольку упоминания о Monica в текстах не связаны с конкретным числом пользователей сервиса Monica.im. В частности, в одном из текстов говорится о Monica Albertini, но не уточняется, что это связано с числом пользователей на платформе Monica.im. 

Таким образом, для получения точной информации о количестве пользователей Monica.im в 2023 году рекомендуется обратиться к официальным источникам сервиса или провести дополнительный поиск для получения актуальной информации о количестве пользователей Monica.im в указанный период времени.","['В 2023 году у Monica.im уже более 1,5 миллионов пользователей.']",['1','5||150'],0.5531505368634428,False
"{'id': 10, 'scene': 'business_consulting', 'source': 'https://github.com/sparticleinc/ASEED/blob/main/datasets/business_consulting.csv', 'language': 'en'}","If Trump takes office again, how will he adjust the trade policy towards China?","If Trump were to take office again, his trade policy towards China is likely to remain aggressive and potentially escalate further. During his previous term, Trump initiated a trade war with China, imposing significant tariffs on Chinese products. If re-elected, Trump is expected to maintain this tough stance on China, potentially increasing tariffs even more, with suggestions of tariffs exceeding 60% on Chinese goods. This approach could strain relations between the two global powers and have far-reaching impacts on international trade dynamics.

Furthermore, there are indications that Trump would also focus on other aspects of trade policy with China. For example, he might renew pressure on South Korea and continue to take a hardline approach towards Chinese leadership, as he has made it clear that he does not have a favorable view of the Chinese leadership. This could lead to further confrontations and tensions between the U.S. and China on multiple fronts, including economic and geopolitical issues.

In summary, if Trump were to be re-elected, it is anticipated that he would persist in his aggressive trade policies towards China, potentially escalating tariff levels and maintaining a tough stance on key economic and strategic aspects of the U.S.-China relationship.","[""If Trump takes office again, his stance on China is expected to remain tough and potentially escalate. During his previous term, Trump initiated a trade war with China by imposing significant tariffs on Chinese imports. He has indicated that if reelected, he plans to intensify this trade war by imposing tariffs as high as 60% or more on Chinese imports\nThis move is part of his strategy to address what he perceives as unfair trade practices by China and to protect American industries and jobs from what he views as Chinese economic threats\nFurthermore, Trump's combative approach towards China extends beyond trade policies. He has expressed intentions to phase out Chinese imports of essential goods over a four-year period, including electronics, steel, and pharmaceuticals. Additionally, Trump aims to ban Chinese companies from owning critical U.S. infrastructure in sectors such as energy, technology, and agriculture, highlighting national security concerns underpinning his China policy\nOverall, Trump's stance towards China is expected to prioritize protecting American economic interests and maintaining a competitive edge in key industries. If reelected, he is likely to continue employing tariffs and trade restrictions to address what he sees as imbalances in the economic relationship between the U.S. and China.""]",['60%'],0.7457347957081463,True
