metadata,question,answer,ground_truths,keywords,answer_correctness,passed
"{'id': 11, 'scene': 'business_consulting', 'source': 'https://github.com/sparticleinc/ASEED/blob/main/datasets/business_consulting.csv', 'language': 'en'}",Microsoft 2021 first quarter Financial report,"The first quarter financial report for Microsoft in 2021 showed impressive growth and performance. Microsoft reported revenue of $45.3 billion, marking a significant 22% increase compared to the previous fiscal year. Operating income also saw a substantial rise of 27%, reaching $20.2 billion. Net income was reported at $20.5 billion GAAP and $17.2 billion non-GAAP, representing a remarkable increase of 48% and 24% respectively. Diluted earnings per share were $2.71 GAAP and $2.27 non-GAAP, showing increases of 49% and 25% respectively. These results highlight the company's strong financial performance during the first quarter of 2021.

The growth in revenue, operating income, and net income emphasizes the success of Microsoft's various business segments, including the Microsoft Cloud, Microsoft Security, Dynamics 365, Microsoft 365 for business, and other key offerings. This growth showcases the increasing demand for Microsoft's services and products across both consumer and enterprise markets. The substantial increases in key financial metrics indicate a robust and thriving business ecosystem for Microsoft during this period.

Additionally, the report underscores Microsoft's commitment to driving innovation and digital transformation across its modern tech stack. The company's strategic focus on enhancing productivity, affordability, and technological advancements plays a significant role in its financial success. Microsoft's continuous efforts to evolve its products and services to meet the changing needs of customers have evidently paid off, as reflected in the strong financial results for the first quarter of 2021.

In conclusion, the first quarter financial report for Microsoft in 2021 demonstrates impressive growth in revenue, operating income, net income, and earnings per share. The report highlights the company's robust performance across various business segments and its dedication to innovation and digital transformation. Microsoft's strong financial results underscore its position as a leading player in the technology industry and reflect its ability to adapt to evolving market conditions and customer demands effectively.","[""Microsoft reported strong financial results for the first quarter of its 2021 fiscal year. The company beat analysts' expectations on both earnings and revenue.\nKey highlights:\nAdjusted earnings per share (EPS) was $1.82, compared to the expected $1.55.\nRevenue grew 12% year-over-year to $37.2 billion, exceeding the expected $35.7 billion.\nMicrosoft's Intelligent Cloud segment, which includes the Azure cloud computing platform, saw revenue grow 20% year-over-year, also beating expectations.\nAzure revenue grew 48% year-over-year, driving the strong performance of the Intelligent Cloud segment.\nOther areas like Surface devices, Xbox gaming, and Microsoft 365 consumer subscriptions also saw significant revenue growth during the quarter.""]",['37.2||372'],0.5718202118390658,False
"{'id': 12, 'scene': 'business_consulting', 'source': 'https://github.com/sparticleinc/ASEED/blob/main/datasets/business_consulting.csv', 'language': 'en'}",What is Toyota's biggest risk in the future?,"In assessing Toyota's biggest risk in the future, there are a few key aspects to consider based on the provided information:

1. **Lag in Pure Battery Electric Vehicles (EVs):**
   Toyota's main risk moving forward lies in its lag behind competitors in the development and production of pure battery electric vehicles (EVs). While the company heavily relies on hybrids and has seen success with this technology, the shift towards EVs as the future of the auto industry poses a significant challenge for Toyota. As the automotive industry evolves and consumer preferences shift towards electric vehicles, Toyota's delay in this segment could potentially impact its market share and competitiveness.

2. **Competitive Landscape and Industry Volatility:**
   The worldwide automotive industry is highly volatile, with fierce competition among global automakers. Despite Toyota retaining its position as the world's largest automaker, competition from rivals like Volkswagen remains a constant factor. The overall market dynamics, technological advancements, and changing consumer preferences create a challenging environment for Toyota to navigate successfully.

3. **Consumer Preferences and Technological Advancements:**
   Consumer preferences are evolving towards electric vehicles due to concerns about environmental impact and technological advancements in the automotive sector. As more consumers opt for EVs and innovative technologies, Toyota's focus on hybrids and potential slower adoption of pure battery EVs could pose a risk in meeting changing market demands and staying competitive in the long run.

In conclusion, Toyota's biggest risk in the future stems from its lag in the pure battery electric vehicle segment, potential challenges in a highly competitive and volatile industry landscape, and the need to align with evolving consumer preferences and technological advancements. To mitigate these risks, Toyota may need to accelerate its efforts in EV development, enhance its competitive strategies, and stay attuned to market trends for sustained success in the dynamic automotive market.","[""Toyota's biggest risk in the future is the consumer adoption of battery electric vehicles (BEVs)""]",['BEVs||EV||Tesla||Evs'],0.6662270492225475,True
"{'id': 13, 'scene': 'business_consulting', 'source': 'https://github.com/sparticleinc/ASEED/blob/main/datasets/business_consulting.csv', 'language': 'en'}",What did Musk say about the future market of the auto industry worldwide?,"Elon Musk has made several significant statements regarding the future market of the auto industry worldwide. Musk emphasized the pivotal role of software in shaping the future of cars, highlighting its importance by stating ""Software is the key to the future of the auto industry."" This underscores the significant influence that technology and software innovations will have on the evolution of the automotive sector. 

Furthermore, Musk has been vocal about the potential for global automakers to expand and disrupt traditional industry players. He expressed a vision for automakers to go global and ""demolish the old legends"" in the industry, illustrating his belief in the transformative possibilities within the automotive market.

In the context of market dynamics and competition, Musk also touched upon the aspect of pricing and market positioning. He mentioned a scenario where equal quality cars were available across all worldwide car companies, emphasizing the impact of China's pricing strategy on the global automotive landscape. 

Overall, Musk's perspectives on the future market of the auto industry worldwide revolve around the crucial role of software, the potential for global expansion and disruption, as well as the influence of pricing strategies on market dynamics and competition. These insights shed light on the direction in which the automotive industry is heading under the influence of technological advancements and market forces.","['Elon Musk warned that Chinese automakers will ""demolish"" their global competition unless other nations impose trade barriers to handicap the new wave of electric cars coming from China\nMusk described Chinese brands like BYD as ""extremely good"" and the ""most competitive"" in the world\nMusk stated that if there are no trade barriers established, Chinese automakers will ""pretty much demolish most other car companies in the world""\nHe believes the Chinese auto industry has a high chance of achieving global domination\nThe search results also indicate that China overtook Japan as the world\'s biggest exporter of cars during 2023 and seems likely to repeat that success in 2024 as it starts to expand its sales activities into Europe\nThis suggests the Chinese auto industry will continue to grow its global market share in the future.\nTo counter this threat, Musk said Tesla is working on a new entry-level model that will use a new platform to slash production costs, allowing it to be sold for less than $30,000\nThis suggests Tesla is trying to make its EVs more affordable to better compete with Chinese automakers.']",['BYD||China||Chinese||中国'],0.6591114613742826,True
"{'id': 14, 'scene': 'business_consulting', 'source': 'https://github.com/sparticleinc/ASEED/blob/main/datasets/business_consulting.csv', 'language': 'en'}",Why is Boeing getting worse and worse?,"Boeing has been facing a series of challenges that have contributed to its declining situation. Several key factors have been pointed out in the sources that shed light on why Boeing is perceived as deteriorating:

1. **Leadership and Management Issues**: Criticisms have been leveled against Boeing's leadership and management practices. Lack of new leadership and poor management decisions, which may have started as far back as the merger with McDonnell Douglas, have been identified as systemic problems that have led to a bottom-line driven approach rather than a focus on quality and safety.

2. **Safety Concerns and Crises**: Boeing has faced significant safety concerns, such as the crashes involving its 737 MAX aircraft. The fallout from these incidents, including the grounding of the fleet for 20 months and subsequent operational disruptions, have severely impacted Boeing's reputation and financial standing.

3. **Quality Control Issues**: Reports have surfaced regarding whistleblowers' complaints about flawed manufacturing processes at Boeing. Allegations of critical flaws being ignored have raised serious questions about the company's commitment to quality assurance and safety standards.

4. **Public Perception and Incidents**: Public perception plays a role in how Boeing is perceived. Recent incidents such as the sudden mid-flight plunge of a 787 Dreamliner and ongoing issues with the 737-900ER have further tarnished Boeing's image in the eyes of the public and industry observers.

While it's crucial to acknowledge that Boeing's situation is complex and influenced by various internal and external factors, the combination of leadership challenges, safety crises, quality control issues, and incidents impacting public perception has contributed to the perception that Boeing is facing a period of decline. Addressing these issues will be crucial for Boeing to regain trust, stability, and its competitive edge in the aerospace industry.","[""Boeing's deteriorating situation is multifaceted and can be attributed to several factors that have contributed to its ongoing challenges. One significant issue lies in Boeing's financial struggles, which have worsened in recent years. The company's heavy focus on profits, coupled with the financial strain caused by the pandemic and the grounding of the 737 Max aircraft, has led to Boeing being in its worst financial shape in over a century, with several years of deep losses recorded\nAdditionally, the dependence on the Defense division to offset losses in the Commercial sector is becoming increasingly unsustainable due to constraints in the US defense budget, leaving Boeing with limited options for recovery in that area\nFurthermore, Boeing's internal culture and safety practices have also come under scrutiny. Reports suggest a lack of a safety culture within Boeing, with claims that employees who raise concerns are ignored, marginalized, threatened, or sidelined\nSuch issues can compromise the overall quality and safety standards of Boeing's aircraft, further eroding consumer trust and damaging the company's reputation.\nOn a more operational level, concerns have been raised about specific incidents, such as the recent recommendation by the FAA to visually inspect the mid-exit door plugs on Boeing 737-900ER aircraft, highlighting potential safety issues that need to be addressed\nThese incidents, in addition to the ongoing challenges faced by the company, contribute to the perception that Boeing's situation is worsening over time.""]",['quality||质量'],0.7205507483841705,True
"{'id': 15, 'scene': 'business_consulting', 'source': 'https://github.com/sparticleinc/ASEED/blob/main/datasets/business_consulting.csv', 'language': 'zh_tw'}",日本百年的藥品製造商小林製藥的紅麴成分含有保健食品引發的「死亡」事件。,"日本百年歷史的藥品製造商小林製藥因其紅麴成分保健食品引發了一起嚴重的事件，數名民眾食用後出現嚴重腎臟疾病，甚至導致「死亡」。這事件持續發展，截至目前，已有數名消費者因服用小林製藥的含有紅麴成分的保健食品而死亡。事件的嚴重性引起了社會廣泛關注，也衝擊了小林製藥這一具有百年歷史的知名公司。 

小林製藥已經展開回收行動，回收了含有問題紅麴成分的所有產品。雖然公司已經採取了措施，但這事件仍然在持續調查中，公司尚未確定事件的原因是來自產品成分還是生產過程中的汙染。這使得事件的輪廓更加模糊，也引發了更多對於保健食品安全的關注。 

這起事件也引起了廠商與監管機構的高度警覺，促使政府加強了監管措施，並提醒民眾注意選擇保健食品時的謹慎。事件也突顯了對於食品安全和監管的重要性，不僅需要公司加強品控，還需要政府更加積極地監督和管理這一領域，以保護民眾的健康和安全。 

在這樣的背景下，小林製藥將面臨來自公眾和監管機構的持續壓力，必須積極應對這次事件帶來的負面影響，並加強透明度、品質控制和風險管理，以重建消費者對其產品的信任。同时，消費者也需要更加謹慎地選擇保健食品，並關注產品的來源和品質，以確保自身的健康和安全。","['食用了小林製藥製造銷售的含紅麴的保健食品的人發生了腎臟疾病，已確認有5人死亡。到目前為止，有212人住院。\n小林製藥的調查顯示，紅麴原料中可能含有""未知成分""，這些成分可能導致腎臟疾病。\n小林製藥的紅麴分為補充劑和食品著色劑兩種，""未知成分""只在部分補充劑批次中被檢測出來。\n紅麴一般被用作食品著色劑，但在作為補充劑使用時，需要注意毒素紅曲霉素的含量。\n小林製藥在這個問題上已開始自願回收相關的保健食品，厚生勞動省也在考慮採取應對措施。']","['5', '212']",0.6943487660363787,False
"{'id': 16, 'scene': 'business_consulting', 'source': 'https://github.com/sparticleinc/ASEED/blob/main/datasets/business_consulting.csv', 'language': 'ru'}","Если Евросоюз решит ""отцепиться"" от Китая, какое влияние это окажет на экономику Германии?","Ответ на ваш вопрос о влиянии ""отцепления"" Евросоюза от Китая на экономику Германии может зависеть от различных факторов и сценариев. В контексте современных экономических отношений и геополитических динамик, отношения между Евросоюзом, Китаем и Германией играют важную роль.

По одной из возможных интерпретаций вашего вопроса, если Евросоюз решит сократить свои экономические связи с Китаем или даже полностью ""отцепиться"" от них, это может повлиять на экономику Германии в следующих аспектах:
1. **Торговля и инвестиции:** Германия является крупным экспортером и импортером товаров, включая торговлю с Китаем. Сокращение торговых связей между Евросоюзом и Китаем может повлиять на германскую экономику через снижение объема торговли и инвестиций между этими странами.
2. **Экономический рост:** Уменьшение экономических связей с Китаем может повлиять на экономический рост Германии, особенно если китайский рынок является значимым для германских компаний.
3. **Влияние на отдельные секторы:** Некоторые отрасли немецкой экономики, например автомобильная промышленность или электротехническая промышленность, могут быть особенно чувствительны к изменениям в экономических отношениях с Китаем.

С другой стороны, следует также учитывать, что глубина и характер этих изменений будут определяться конкретными шагами, которые могут принять страны Евросоюза в отношении своих экономических связей с Китаем. Решения политического и экономического порядка могут смягчить или усилить эти влияния на экономику Германии.","['Исследования показывают, что если Евросоюз откажется от связей с Китаем, экономический вывод Германии сократится на 1%. В краткосрочной перспективе экономический вывод Германии снизится примерно на 5%. Среднесрочно и долгосрочно процентное сокращение экономического процветания Германии составит около 1,5% в год.']",['1%||5%||1.5%'],0.5420276807430696,False
"{'id': 17, 'scene': 'business_consulting', 'source': 'https://github.com/sparticleinc/ASEED/blob/main/datasets/business_consulting.csv', 'language': 'ja'}",虎ノ門ヒルズフォーラム,"**虎ノ門ヒルズフォーラム**は、東京都港区に位置する虎ノ門ヒルズ森タワー内の4階と5階にある大型のカンファレンスセンターです。この施設は、2022年12月21日に更新された情報によると、各種イベントに対応するために3つのホールと4つのミーティングルームで構成されています。メインホールやガラスカーテンウォールで開放的な空間のホールAなど、多様なイベントの開催に適しています。

虎ノ門ヒルズフォーラムは、地下駐車場があり、周辺のアクセスも便利です。最寄りの駅は東京メトロ銀座線の虎ノ門駅や日比谷線の神谷町駅から徒歩でアクセス可能です。また、新橋駅からも徒歩圏内でアクセスできます。エリアの賑わいや都心部の便益を考慮しつつ、イベント開催に最適な設備やサービスを提供しています。

施設の特徴として、ホールBでは最大460名、メインホールでは最大720名、ホールAでは最大792名の定員を誇っており、多様な規模のイベントに対応できます。利用時間は午前9時から夜9時までとなっており、交通機関からのアクセスもアクセス案内が詳細に案内されています。

虎ノ門ヒルズフォーラムは、日本や世界からのイベントやカンファレンスをサポートし、最新の設備・設備を提供することで、エリアの活性化や国際交流の場を提供しています。",['虎ノ門ヒルズフォーラムは、虎ノ門ヒルズ森タワー内に位置するイベント施設で、2014年5月に竣工しました。このフォーラムは、3つのホールと4つのミーティングルームから構成されており、590m²のメインホールと合計6つの会議室が利用可能です。メインホールは最大720名を収容し、各ホールは異なる形式のイベントに対応できます。装備されている設備には、360インチスクリーンや電動バトンなどがあり、多種多様なイベントに対応しています。\n\n主な情報:\n\n名称: 虎ノ門ヒルズフォーラム\n所在地: 東京都港区虎ノ門1-23-1\n最寄り駅: 東京メトロ銀座線「虎ノ門駅」、東京メトロ日比谷線「神谷町駅」\n収容人数: メインホール最大720名、ホールA最大792名、ホールB最大460名\n利用時間: 9:00～21:00'],"['590m²', '虎门山森大厦||虎ノ門ヒルズ森タワー']",0.7294550858790818,True
"{'id': 18, 'scene': 'business_consulting', 'source': 'https://github.com/sparticleinc/ASEED/blob/main/datasets/business_consulting.csv', 'language': 'zh_tw'}",腾訊的天使投資者叫什麼名字？,腾讯的天使投资者中有一位名叫许晓萍（Xu XiaoPing）。此外，腾讯在其投资中将“价值创造”置于核心位置，其主要目标是为用户创造价值。腾讯认为投资是其核心战略之一，始终将用户利益放在首位，投资公司放在第二位。,['腾讯的天使投资商包括刘晓松、IDGVC（後更名為IDG資本）、香港盈科數碼和南非的MIH。此外，曾李青也是腾讯的天使投资人之一，他在離開腾讯後成立了德迅投资。'],['劉曉松||IDG||香港盈科||MIH||曾李青'],0.5464947770135407,False
"{'id': 19, 'scene': 'business_consulting', 'source': 'https://github.com/sparticleinc/ASEED/blob/main/datasets/business_consulting.csv', 'language': 'zh_tw'}",华为2023年营收情况？,"根据搜索结果，华为在2023年取得了令人瞩目的业绩。在该年度，华为的全球销售收入达到了7042亿元人民币，净利润为870亿元人民币. 这意味着华为在2023年实现了近9.63%的年同比增长率，净利润同比增长144.5%. 华为的研发投入也持续强劲，达到1647亿元人民币，占销售收入的23.4%. 这显示了华为对于技术创新的持续投入和重视，为未来的发展奠定了坚实基础。

华为2023年的业绩报告透露出几个重要信息。首先，华为在多个业务板块取得了良好的增长，包括ICT基础设施、终端业务、云计算、数字能源以及智能汽车解决方案等领域. 这些业务的表现带动了整体营收的增长，显示出华为在不同领域的强劲实力。第二，华为的净利润大幅增长，主要得益于规模的扩张、产品结构的优化以及出售部分业务所带来的收益. 尽管面临复杂的外部环境挑战，华为依然保持着稳健的发展态势。

总体而言，华为在2023年取得的营收和净利润都呈现出积极的增长趋势，显示了公司在全球市场的竞争力和韧性。同时，持续的研发投入和多元化业务布局为华为未来的发展奠定了坚实基础，使其能够继续在科技行业中发挥重要作用。","['華為2023年的主要財務數據如下:\n全年實現營業收入7042億元人民幣,同比增長9.63%。\n實現淨利潤870億元人民幣,同比大增144.38%。\nICT基礎設施業務實現銷售收入3620億元,同比增長2.3%。\n終端業務實現銷售收入2515億元,同比增長17.3%。\n雲計算業務實現銷售收入553億元,同比增長21.9%。\n數字能源業務實現銷售收入526億元,同比增長3.5%。\n智能汽車解決方案業務實現銷售收入47億元,同比增長128.1%']","['7042||7', '042']",0.75561355408863,True
"{'id': 20, 'scene': 'business_consulting', 'source': 'https://github.com/sparticleinc/ASEED/blob/main/datasets/business_consulting.csv', 'language': 'ja'}",光通信社の株式コードは何ですか？,光通信社の株式コードは9435です。株式コードは、企業を証券取引所で一意に識別するための番号であり、株式市場で取引される企業の株式を特定するのに使用されます。光通信社は東京証券取引所のプライム市場で取引されており、その株式コードは9435となっています。,['光通信社の株式コードは「9435」です'],['9435'],0.7666719169526652,True
