metadata,question,answer,ground_truths,keywords,answer_correctness,passed
"{'id': 2, 'scene': 'real_time_news', 'source': 'https://github.com/sparticleinc/CRED/blob/main/datasets/real_time_news.csv', 'language': 'zh-cn'}",海康威视去年的业绩如何,"海康威视在2023年的业绩表现如下：公司实现营业收入893.40亿元，同比增长7.42%；归属于上市公司股东的净利润为141.08亿元，同比增长9.89%。此外，归属于上市公司股东扣除非经常性损益的净利润为136.66亿元，同比增长10.83%；基本每股收益为1.520元/股。这些数据表明，海康威视在2023年实现了稳健的增长，无论是在营业收入还是净利润方面都有所提升。
",['在2023年，海康威视的业绩恢复增长，公司实现了营业收入893.55亿元，同比增长7.44%，净利润为141.17亿元，同比增长9.96%。'],"['2023', '893.55||893']",0.7280117945308965,True
"{'id': 3, 'scene': 'real_time_news', 'source': 'https://github.com/sparticleinc/CRED/blob/main/datasets/real_time_news.csv', 'language': 'zh-cn'}",百川最新的融资,"百川智能最新的融资情况显示，该公司在2024年进行了新一轮的数亿美元融资。这一轮融资被视为国内2024年最大的AI领域融资之一。尽管具体的融资金额和完成情况尚未最终确定，但有报道称，百川智能的估值在此轮融资后已超过18亿美元，约合人民币130亿。然而，也有报道指出，百川智能对于数亿美元融资的传闻进行了否认，表示公司并未官方对外披露过最新融资信息，且报道中涉及的金额也不准确。
综合以上信息，可以得出结论，百川智能确实在2024年进行了新一轮的融资活动，且该轮融资规模巨大，有望成为当年国内AI领域最大的融资案例之一。但是，关于融资的具体金额和完成情况，目前尚存在一定的不确定性，需要进一步的官方确认。
","['有媒体报道称,百川智能正在进行新一轮数亿美元融资,将成为2024年国内AI领域最大融资之一,且公司今年以来估值已超18亿美元']",['18'],0.7804412154309672,True
"{'id': 4, 'scene': 'real_time_news', 'source': 'https://github.com/sparticleinc/CRED/blob/main/datasets/real_time_news.csv', 'language': 'ja'}",最近の台湾の地震での死傷者数は何人ですか?,"最近的台湾地震造成的死傷者数根据最新的报道，死亡人数为13人，受伤人数为1145人。这些数据是根据台湾灾害应变中心和央视新闻在2024年4月4日和4月5日的最新统计得出的。因此，可以确认的是，截至最后更新的时间点，台湾地震已造成至少13人死亡，1145人受伤。
",['台灣花蓮地震死亡數字上升。10日救援人員在花蓮太魯閣區域砂卡礑步道尋獲3具遺體，花蓮7.3級地震罹難人數上升至16人。'],['16'],0.5347226255847407,False
"{'id': 5, 'scene': 'real_time_news', 'source': 'https://github.com/sparticleinc/CRED/blob/main/datasets/real_time_news.csv', 'language': 'ja'}",最近の埼玉県行田市事故の死傷者数は何人ですか?,"最近埼玉県行田市で発生した事故の死傷者数は、死亡者1人、負傷者3人です。
",['最近の埼玉県行田市の事故での死傷者数は以下の通りです:\n死亡者数: 1人\n負傷者数: 3人'],['1||3||4'],0.9845524835982635,True
"{'id': 6, 'scene': 'real_time_news', 'source': 'https://github.com/sparticleinc/CRED/blob/main/datasets/real_time_news.csv', 'language': 'ja'}",藤岡康太騎手の怪我はどうでしたか？,"藤岡康太骑手的事故导致他离开了我们。这表明他的伤势相当严重，以至于影响到了他的生命安全。因此，可以推断藤岡康太骑手的怪我是非常严重的。
",['藤岡康太騎手は、2024年4月6日に行われた阪神競馬場の第7レースで落馬し、頭部と胸部を負傷しました.この落馬の後、藤岡騎手は病院に搬送され、意識を取り戻すことなく、後に怪我のため亡くなりました.この悲報は日本中央競馬会(JRA)からも発表されました'],['亡'],0.5254130024048221,False
"{'id': 7, 'scene': 'real_time_news', 'source': 'https://github.com/sparticleinc/CRED/blob/main/datasets/real_time_news.csv', 'language': 'zh-tw'}",士林區溪山里事件的起因是什麼？,,['士林區溪山里事件的起因是與水質問題有關。根據報導，溪山里的居民平常使用自行成立的供水系統，主要使用山泉水作為飲用水源。然而，由於地震等自然災害可能導致山泉水受到污染，進而造成水質問題。事件中大腸桿菌群數值偏高，反映了水質有異常情況，因此許多居民出現了腹瀉和嘔吐等腸胃道疾病症狀。台北市政府為了緊急應對此情況，已提供緊急取水站以及醫療服務，並展開全面水質檢測及環境消毒等措施以解決問題。因此，士林區溪山里事件的起因主要是因為使用的山泉水受到污染所導致的水質問題。'],['地震'],0.38676675598093685,False
"{'id': 8, 'scene': 'real_time_news', 'source': 'https://github.com/sparticleinc/CRED/blob/main/datasets/real_time_news.csv', 'language': 'ja'}",3月のCPI,"2024年3月份，全国居民消费价格指数（CPI）同比上涨0.1%。这一数据由多个来源确认，包括国家统计局、光明网、新华网和人民日报等权威机构发布的消息。此外，从环比的角度来看，3月份CPI下降了1.0%，这表明与上个月相比，物价水平有所下降。
具体到分类数据，食品价格在3月份同比下降了2.7%，而非食品价格上涨了0.7%。消费品价格下降了0.4%，服务价格上涨了0.8%。这些数据显示，尽管整体CPI保持稳定，但不同类别的商品和服务价格表现出了不同的趋势。
值得注意的是，扣除食品和能源价格的核心CPI同比上涨了0.6%，这可能反映了除食品和能源外的其他商品和服务价格变动对总CPI的影响。此外，食品烟酒类价格同比下降了1.4%，对CPI的下降贡献了约0.40个百分点。
综上所述，2024年3月份中国的CPI同比小幅上涨0.1%，显示出物价总体温和上涨的趋势，但环比则出现了季节性的下降。各类商品和服务的价格变动也呈现出多样性，其中食品价格的下降是影响CPI的主要因素之一。
",['2024年3月の日本のCPIは2.8%'],['2.80%'],0.508548702548101,False
"{'id': 9, 'scene': 'real_time_news', 'source': 'https://github.com/sparticleinc/CRED/blob/main/datasets/real_time_news.csv', 'language': 'ja'}",今年はどの国で日食が見られますか。,"今年可以在北美洲、墨西哥、美国和加拿大观测到日全食。此外，根据天文观测数据，亚洲地区，包括中国、蒙古国、俄罗斯等国家也将在2024年7月2日看到日食。因此，今年可以在北美洲和亚洲的某些国家观测到日食。
",['2024年4月8日:\nメキシコ、アメリカ合衆国、カナダ: 皆既日食が観測される予定です'],['メキシコ||アメリカ合衆国||カナダ'],0.7242399478586872,False
"{'id': 10, 'scene': 'real_time_news', 'source': 'https://github.com/sparticleinc/CRED/blob/main/datasets/real_time_news.csv', 'language': 'zh-cn'}",海康威视去年的业绩如何,"海康威视在2023年的业绩表现如下：公司实现营业收入893.40亿元，同比增长7.42%；归属于上市公司股东的净利润为141.08亿元，同比增长9.89%。此外，归属于上市公司股东扣除非经常性损益的净利润为136.66亿元，同比增长10.83%；基本每股收益为1.520元/股。这些数据表明，海康威视在2023年实现了稳健的增长，尤其是在净利润方面，增长率达到9.89%，显示出公司的盈利能力有所提升。此外，公司在智能物联领域的战略转型也取得了初步成效，营收和利润均实现了双增长。因此，可以总结说，海康威视去年的业绩表现良好，实现了营业收入和净利润的增长，且在智能物联战略转型方面取得了积极进展。
",['在2023年，海康威视的业绩恢复增长，公司实现了营业收入893.55亿元，同比增长7.44%，净利润为141.17亿元，同比增长9.96%。'],"['2023', '893.55']",0.7385662294436857,False
"{'id': 11, 'scene': 'real_time_news', 'source': 'https://github.com/sparticleinc/CRED/blob/main/datasets/real_time_news.csv', 'language': 'en'}",How many Israelis died in the attack launched by Iran?,"伊朗对以色列发动的袭击导致了至少14名以色列人死亡。此外，证据表明，这次冲突是作为对以色列在4月1日轰炸叙利亚大马士革的一个伊朗领事馆附属建筑并杀死多名高级伊朗官员的直接回应。然而，关于以色列方面的具体死亡人数，我搜索到的资料中没有更详细的数字。因此，基于现有资料，可以确认的是至少有14名以色列人在伊朗的袭击中死亡。
","['According to the reports, there were no reported fatalities from the Iranian attack on Israel']",['no casualties'],0.48778701436450966,False
"{'id': 12, 'scene': 'real_time_news', 'source': 'https://github.com/sparticleinc/CRED/blob/main/datasets/real_time_news.csv', 'language': 'en'}",Whom did Putin say carried out the Moscow attack?,"普京表示，莫斯科袭击是由“激进伊斯兰主义者”执行的。此外，没有提及美国在袭击两周前秘密分享的关于即将发生的恐怖袭击警告，也没有提及与袭击有关的其他细节。因此，根据普京的说法，是“激进伊斯兰主义者”实施了莫斯科的袭击。
","['Vladimir Putin stated that ""radical Islamists"" were behind the deadly attack on the Crocus City concert hall in Moscow']",['radical Islamists'],0.6995308691488752,False
"{'id': 13, 'scene': 'real_time_news', 'source': 'https://github.com/sparticleinc/CRED/blob/main/datasets/real_time_news.csv', 'language': 'en'}",What precisely caused the ship to collide with the Baltimore bridge?,"巴尔的摩弗朗西斯·斯科特·基桥（Francis Scott Key Bridge）与一艘货船相撞导致桥梁部分坍塌的具体原因尚未完全明确。然而，根据现有资料，可以推断出几个可能的因素。
首先，有报道指出，这艘名为Dali的集装箱船在撞击桥梁之前正在进行“常规引擎维护”。这表明船只可能因为维护过程中出现的问题而失去了动力，并且在撞击前调整了航向并开始冒烟。这些情况可能导致了船只控制上的失误，从而增加了与桥梁发生碰撞的风险。
其次，Dali船在撞击桥梁之前曾涉及一起事故，在2016年撞上了一个石制码头。这表明该船只可能存在结构或操作上的问题，这些问题可能在此次撞击中被触发。
综上所述，虽然无法确定确切的原因，但可以推测，Dali船在进行常规引擎维护期间可能遇到了电力或其他技术问题，这些问题导致了船只失去控制并最终撞击了桥梁。同时，船只之前的历史事故也可能对其操作和安全性产生了影响。然而，需要更多的信息来准确地确定导致撞击的具体原因。
","['When the container ship MV Dali, 300 metres long and massing around 100,000 tonnes, lost power and slammed into one of the support piers of the Francis Scott Key Bridge in Baltimore, the bridge collapsed in moments.']",['lost power'],0.5263813600352566,False
"{'id': 14, 'scene': 'real_time_news', 'source': 'https://github.com/sparticleinc/CRED/blob/main/datasets/real_time_news.csv', 'language': 'en'}",Which island recently experienced a volcanic eruption in Indonesia?,"最近在印度尼西亚经历火山喷发的岛屿是Ruang岛。Ruang火山位于北苏拉威西省的Ruang岛上，该火山在2024年4月16日至17日增加了其火山活动，并发生了爆炸。这表明Ruang岛上的Ruang火山最近经历了火山喷发。
",['The name of the volcano is Mount Ruang on the northern side of Sulawesi Island.'],['Sulawesi island||Mount Ruang'],0.6717917016099352,False
"{'id': 15, 'scene': 'real_time_news', 'source': 'https://github.com/sparticleinc/CRED/blob/main/datasets/real_time_news.csv', 'language': 'en'}",What did the leaders of the three countries say?,"三个国家的领导人分别在不同的场合发表了声明：


美国和日本的联合领导人声明强调了全球伙伴合作的未来，但具体内容未在证据中提及。


G7（七国集团）的领导人与乌克兰总统泽连斯基会面，重申了对乌克兰的坚定支持，并再次赞扬乌克兰人民为乌克兰的自由和民主未来不懈战斗的勇气和韧性。3.这三个国家的领导人主要表达了对乌克兰的支持、对伊朗攻击以色列行为的强烈谴责，以及东盟与澳大利亚在和平与繁荣方面的合作愿景。


","['The leaders of the United States, Japan, and the Philippines recently held a summit. Here are some key points from their discussions:\n1. Shared Vision: They issued a “Joint Vision Statement” affirming their shared vision of a free and open Indo-Pacific and international order based on international law12.\n2. Security and Economy: They discussed various areas of security and economy, and expressed a desire to advance Japan-U.S.-Philippines cooperation based on this Summit2.\n3. Regional Situation: They discussed the security environment in the region and confirmed their unwavering commitment to freedom of navigation and overflight2.\n4. Opposition to Unilateral Actions: They confirmed that they would oppose and resolutely respond to any attempts by the People’s Republic of China (PRC) to unilaterally change the status quo by 5. force in the South China Sea and the East China Sea2.\n5. Inclusive Economic Growth: They resolved to promote enduring, inclusive economic growth and resilience in their countries and the broader Indo-Pacific1.\nStrengthening Alliances: The Philippines’ decision to strengthen ties with Japan and the United States was described as a “sovereign choice” for the country3.']","['United States', 'Japan', 'Philippines']",0.48891641711339656,False
"{'id': 16, 'scene': 'real_time_news', 'source': 'https://github.com/sparticleinc/CRED/blob/main/datasets/real_time_news.csv', 'language': 'en'}",Google fires 28 employees over protests inside work offices,未找到有关的结果，请检查你的拼写或尝试使用其他关键字。,"['Google fired 28 workers Wednesday in Sunnyvale and New York, calling their protests inside work offices “completely unacceptable behavior” that prevented some employees from accessing their facilities.\n\nThe tech giant said protests on Tuesday over the company’s contracts with Israel disrupted several locations. The Chronicle reported that at Google’s Sunnyvale offices, police arrested five workers who held a sit-in Tuesday to protest their employer’s cloud contract with the Israeli government.']","['contracts', 'Israel']",0.425757329419259,False
"{'id': 17, 'scene': 'real_time_news', 'source': 'https://github.com/sparticleinc/CRED/blob/main/datasets/real_time_news.csv', 'language': 'en'}",How many soldiers were wounded in the attack launched by Hezbollah on northern Israel recently？,本次请求涉及的领域暂不支持,"['n the recent attack launched by Hezbollah on northern Israel, a total of 14 soldiers were wounded. Among those injured, six of them were reported to be seriously wounded. The attack involved a combination of missiles and drones targeting a military base in northern Israel, specifically the Bedouin border town of Arab al-Aramshe. This assault by Hezbollah was a significant event in the ongoing conflict between the group and Israel.']",['14'],0.40048627261288844,False
"{'id': 18, 'scene': 'real_time_news', 'source': 'https://github.com/sparticleinc/CRED/blob/main/datasets/real_time_news.csv', 'language': 'en'}",What weapons were used to attack Israel from Iran?,"伊朗对以色列发动的攻击使用了多种武器。具体到导弹类型，包括Kheibar Shekan弹道导弹和Emad弹道导弹。这些信息表明，伊朗在对以色列的攻击中使用了多样化的武器系统，包括无人机、巡航导弹以及特定型号的弹道导弹。
","['Iran fired 170 drones, more than 30 cruise missiles and more than 120 ballistic missiles. Of those, several ballistic missiles reached Israeli territory, causing minor damage to an air base.']","['drones', 'missiles']",0.5015986773321048,False
"{'id': 19, 'scene': 'real_time_news', 'source': 'https://github.com/sparticleinc/CRED/blob/main/datasets/real_time_news.csv', 'language': 'en'}",Why is GTA 6 publisher laying off 600 employees,"GTA 6的出版商Take-Two Interactive决定裁员600名员工的原因主要是为了实施一项更广泛的成本削减策略。尽管去年净收入增长了53%，但公司仍然计划通过减少其工作 force的5%，即大约600名员工，并取消一些正在开发中的项目来每年节省1.这一决策是作为对游戏行业面临的挑战和不确定性的一种反应，特别是在经历了疫情后的两年裁员期之后。此外，这一举措也是为了应对游戏行业的整体趋势，包括对疫情期间增加的员工数量进行调整以及降低销售预期。因此，尽管Take-Two Interactive在财务上表现强劲，但为了保持公司的运营效率和财务健康，公司决定采取这些措施。
","[""The decision to lay off approximately 600 employees at Take-Two Interactive, the parent company of Rockstar Games, is part of a broader cost-cutting strategy. The company is rationalizing its pipeline, eliminating several projects in development, and streamlining its organizational structure. This downsizing process is expected to be largely complete by the end of the year 2024. Additionally, Take-Two had already signaled its intention for a significant cost reduction plan following mixed financial results for the quarter ending in December 2023. Despite these challenges, Take-Two has continued to invest in its portfolio, including the acquisition of Gearbox and the development of the highly anticipated 'GTA 6'.""]",['cost-cutting'],0.653877540882911,False
"{'id': 20, 'scene': 'real_time_news', 'source': 'https://github.com/sparticleinc/CRED/blob/main/datasets/real_time_news.csv', 'language': 'en'}","The world’s best airports for 2024, according to Skytrax","根据Skytrax的排名，2024年世界最佳机场的前几名分别是：多哈哈马德国际机场、新加坡樟宜机场和首尔仁川国际机场。新加坡樟宜机场虽然失去了连续多年的“世界最佳机场”称号，但它仍然是一个顶级的机场，与多哈哈马德国际机场一起，长期以来一直是争夺“世界最佳机场”头衔的主要竞争者。首尔仁川国际机场在2024年的排名中位列第三。
此外，其他一些机场也在2024年的Skytrax排名中表现突出，包括汉达机场、成田机场、巴黎戴高乐机场、迪拜国际机场、慕尼黑国际机场、苏黎世机场和伊斯坦布尔国际机场等。这些机场因其卓越的服务、设施和旅客体验而受到高度评价。
需要注意的是，尽管有多个来源提到了多哈哈马德国际机场和新加坡樟宜机场的排名情况，但具体到每个机场的详细排名可能会有所不同，这取决于Skytrax调查的具体标准和方法。因此，在参考我搜索到的资料时，应考虑到可能存在的细微差异。
","[""According to the Skytrax rankings for 2024, Doha's Hamad International Airport has been named the best airport in the world.""]","[""Doha's Hamad""]",0.5173462861199974,False
