metadata,question,answer,ground_truths,keywords,passed
{},OPENAI APIを通じて入れたデータは学習される？,"はい、OpenAI APIを通じて入力されたデータは学習されます。ただし、APIデータは30日間保持され、悪用や不正使用の監視のために使用されます。また、OpenAIはAPIデータをサービスの改善（モデルのトレーニングを含む）には使用しない方針を採用しています。
ご質問にお答えするために、以下のソースを参照しました：

ソース：OpenAIはAPIデータを30日間保持し、悪用
",['1. OpenAIは、APIを通じて送信されたデータを、OpenAIのモデルの学習や改善には使用しません。ただし、ユーザーが明示的に同意した場合は、そのデータを使用することができます。\n2. APIを通じて送信されたデータは、不正利用や監視のために最大30日間保持されます。その後は削除されます。ただし、法的要求がある場合はこの限りではありません。\n3. ユーザーがファイルエンドポイントを通じて送信したデータ(例えばモデルのファインチューニング用)は、ユーザーが削除するまで保持されます。\n4. この利用ポリシーはOpenAIのコンシューマ向けサービス(ChatGPTやDALL-E)には適用されません。それらのサービスについては別のポリシーが適用されます。'],['しません||30'],True
{},Azure OpenAI Service Abuse Monitoringについての記載を教えて？,"Azure OpenAI Service Abuse Monitoringについて
Azure OpenAI Serviceは、コンテンツフィルタリングと悪用監視の機能を備えています。悪用監視は、サービスの利用が行動規範やその他の適用製品条件に違反する可能性がある場合に、繰り返しのコンテンツや行動のインジケーターを検出し、対処します。悪用監視は、顧客のプロン",['はい、Azure OpenAI Service の不正利用監視についての概要は以下になります。\n\nコンテンツ分類:\n\n入力プロンプトや出力コンテンツを分析し、ハラスメントや差別的な内容などを検知\n深刻度のレベルを判定\n悪用パターンの検知:\n\n顧客の利用パターンを分析し、悪用の兆候を検出\n有害コンテンツの検出頻度や深刻度などを考慮\n人的レビューと判断:\n\nコンテンツ分類や悪用パターンの検知結果について、Microsoft社内の権限ある社員がレビューを行い、適切な判断を下す\n社員はセキュアなワークステーションからのみデータにアクセス可能\n通知と措置:\n\n一定水準の悪用行為が確認された場合、顧客に通知し、是正を求める\n顧客が対応しない場合や、悪用が継続・深刻な場合は、サービスへのアクセスを停止・終了する措置を取る'],['コンテンツ分類||悪用パターンの検知||人的レビューと判断||通知と措置'],False
{},Anthoropic Claude のデータ保持期間は？,"Anthropic Claude のデータ保持期間は公開されていません。ただし、Anthropicの公式ウェブサイトによると、Claude 3モデルは長い文脈を効率的に処理するために、最大200,000トークンの文脈長をサポートしています。データ保持期間に関する具体的な情報は提供されていませんので、詳細はAnthropicに直接お問い合わせいただくことをおすすめします。
もし他の質問がありましたら、お気軽にどうぞ！",['Anthoropic Claude のデータ保持期間は、通常は受信または生成後90日以内にバックエンドでプロンプトと出力を自動的に削除しますが、信頼性およびセキュリティの分類子によってフラグが立てられたプロンプトの場合は最大2年間保持されます。'],['90'],False
{},OpenAI APIで入力されたデータは人間に見られますか？,はい、OpenAI APIで入力されたデータは一部の人間に見られる可能性があります。OpenAIは、乱用や誤用の監視のためにAPIデータを30日間保持しています。機密保持とセキュリティの義務を負う限られた数の認可されたOpenAIの従業員や専門の第三者契約業者が、このデータにアクセスすることができ,['デフォルトの場合，OpenAI APIに提出されたデータはAIモデルの訓練には利用されない.'],['されない'],False
{},Anthoropic Claude のデータポリシーは？,"Anthropic Claude のデータポリシーについては、具体的な情報が提供されていませんでした。ただし、AnthropicはAIスタートアップであり、Claude 3という大規模な言語モデルを開発しています。Claude 3は、日本語をサポートし、OpenAIのGPT-3.5よりも高いスコアを持っていると報告されています。
データポリシーに関する詳細な情報を入手するためには、Anthropicの公式ウェブ",['ユーザーの個人データは、モデルのトレーニングに使用されないため、ユーザーデータを利用してモデルを構築することはありません。'],['されない'],False
{},OPENAIAssistant API のストレージの上限は？,OpenAIAssistant APIのストレージの上限については、検索結果からは明確な情報が得られませんでした。申し訳ありませんが、具体的な上限については公式ドキュメントやOpenAIのサポートにお問い合わせいただくことをおすすめします。,['OpenAI Assistant API には以下のストレージの上限があります:\nアシスタントごとに最大20個のファイルを添付できる\n各ファイルの最大サイズは512MB\n組織がアップロードする全ファイルの限界サイズは100GB\nつまり、1つのアシスタントに最大20個の合計512MB以下のファイルを添付でき、組織全体では最大100GBまでアップロードできるということです。これらの制限は現在のベータ版の仕様であり、今後変更される可能性があります'],"['20', '512', '100']",False
{},請教如何在Evernote中插入元素。,"在Evernote中插入元素的方法
要在Evernote中插入元素，您可以按照以下步骤进行操作：


插入图片或文件：您可以通过设置导入文件夹来从计算机保存图片、PDF和其他文件类型到Evernote中。将文件放入导入文件夹后，它们将自动添加并同步到您的Evernote帐户中。


导出笔记和笔记本：您还可以将笔记和笔记本导出

","['要在Evernote中插入元素，請參考以下步驟：\n\n打開筆記，在想插入元素的地方放置游標。\n按下""/""鍵來插入元素。\n選擇要插入的元素類型。例如，可以選擇清單、表格或其他元素。\n選擇好要插入的元素後，它將顯示在筆記中。']","['""/""']",False
{},Windows 11中如何在壓縮文件時設置密碼,"在Windows 11中，您可以使用壓縮文件時設置密碼的功能。以下是設置密碼的步驟：

選擇要壓縮的文件或文件夾。
右鍵點擊選中的文件或文件夾，然後選擇“添加到壓縮文件”。
在壓縮文件對話框中，選擇壓縮格式（如ZIP）。
在壓縮文件對話框中，點擊“設置密碼”
",['在Windows 11中壓縮文件並設置密碼的方法是有的。具體步驟如下：\n\n首先，下載並安裝如7-Zip等文件壓縮軟件。\n選擇要設置密碼的文件或文件夾，右鍵點擊，選擇「7-Zip」→「添加到壓縮文件」。\n接下來，在新打開的窗口中，從「壓縮級別」下拉菜單中選擇「存儲」，在右側的「加密」部分輸入密碼。\n輸入完密碼後，點擊「確定」。這樣就會在同一文件夾中創建一個擁有.7z擴展名的文件，該文件已被密碼保護。\n當您試圖打開文件時，需要輸入密碼才能訪問文件內容。無論在其他計算機還是平台上使用其他壓縮軟件打開該文件，都需要輸入相同的密碼。'],['7-Zip'],False
{},Как установить файл IPA на iOS?,"Как установить файл IPA на iOS?
Для установки файла IPA на устройство iOS можно использовать несколько методов. Один из самых распространенных способов - использование программы iTunes. Вот пошаговая инструкция:

Подключите ваше устройство iOS к компьютеру с помощью кабеля USB.
Откройте программу iTunes на компьютере.
В верхней части iTunes выберите устройство, к которому вы хотите установить файл IPA.
В боковой панели iTunes выберите ""Apps"" (Приложения).
Прокрутите
","['Использование синхронизации через iTunes:\nПодключите устройство iOS к компьютеру и откройте iTunes.\nВыберите устройство в iTunes и перейдите на вкладку ""Приложения"".\nПеретащите загруженный файл IPA в окно ""Приложения"".\nУбедитесь, что файл добавлен в список, затем нажмите кнопку ""Синхронизировать"".\n\nПрямая установка с помощью сторонних инструментов:\nСкачайте и установите сторонний инструмент установки на устройство iOS, такой как PP Helper или iFunbox.\n\nПодключите устройство к компьютеру и запустите инструмент установки.\nНайдите файл IPA, который нужно установить, в инструменте и нажмите ""Установить"".\n\nИспользование AltStore для установки:\nЗагрузите и установите приложение AltStore.\nОткройте в Safari браузере веб-сайт AltStore, загрузите нужный файл IPA.\nПеретащите файл IPA в приложение AltStore и дождитесь завершения установки.\n\nУстановка через Cydia:\nДля этого потребуется джейлбрейк устройства iOS.\nУстановите плагин AppSync через Cydia.\nПеренесите файл IPA на устройство с помощью инструмента, такого как iFunBox, а затем используйте инструмент AppInstall в Cydia для установки.\n\nИспользование Apple App Installer через Safari браузер:\nОткройте в Safari адрес Apple App Installer и импортируйте необходимый сценарий для установки.\n\nУстановка через 3uTools на компьютере с Windows:\nПодключите iPhone к компьютеру и используйте функцию ""Файловое общение"" в iTunes для добавления и установки файла IPA.\n\nПрямая установка с помощью подписи Apple Enterprise, SuperSign или TF:\nИспользуйте методы прямой установки на устройство с помощью подписи Apple Enterprise, SuperSign или TF.']","['iTunes', 'Safari']",False
{},Как использовать ChatGPT для перевода PDF-документов?,"Для перевода PDF-документов с использованием ChatGPT вы можете воспользоваться сервисом DocTranslator. Этот сервис использует технологию искусственного интеллекта, основанную на модели ChatGPT, чтобы предложить более эффективный и точный способ перевода текста.
Вот пошаговая инструкция по использованию сервиса DocTranslator для перевода PDF-документов:

Загрузите свой файл на сайт DocTranslator.
Выберите язык, на который вы хотите перевести документ.
Нажмите кноп
","['1. Преобразуйте PDF-документ в редактируемый текстовый формат, такой как TXT или DOC.\n2. Подайте этот текст в ChatGPT для последовательного перевода содержимого документа по предложениям.']","['TXT', 'Преобразовать||Преобразуйте']",False
{},gpt-3-5-turbo-0125 1M цена,"The price for the GPT-3.5 Turbo-0125 model is $0.0005 per 1,000 tokens for input and output .","['Входной токен стоит $0,50, а выходной токен стоит $1,50.']","['$0', '50', '1']",False
{},我想在edge浏览器查看新闻，但不喜欢自带的资讯源，有什么推荐的新闻源吗？,"您可以尝试以下推荐的新闻源来在Edge浏览器上查看新闻：


Microsoft News：Microsoft News是微软提供的新闻聚合平台，提供各种类别的新闻报道和文章。您可以在Edge浏览器上访问Microsoft News网站或者在新标签页中选择""资讯""选项卡来浏览最新的新闻内容。


BBC News：BBC News是英国广播公司提供的全球新闻服务。他们的报道涵盖了全球

","['1.打开新标签页，在建议的网站磁贴正上方，您会看到一个""Customize""(自定义)选项\n2.点击该选项，接着在下一个界面确保您选择了""Top sites and my news feed""(热门网站和我的新闻源)\n选择您希望获取新闻的语言，\n3.在语言选择下方，您会看到用于选择您希望查看的内容类型的类别']",['Customize||自定义'],False
{},hostinger选择中国，服务器可以是全球吗,"可以选择Hostinger作为您的服务器提供商，即使您选择中国作为服务器位置，Hostinger仍然可以提供全球范围的服务器。Hostinger提供各种托管计划，包括共享托管、虚拟专用服务器（VPS）和云计划，以满足您的在线需求。无论您的目标受众在哪个地区，Hostinger都可以为您提供适当的服务器解决方案。
请注意，Hostinger在全球范围内拥有多个数据中心，这意味着您",['虽然Hostinger在中国没有服务器，但是您可以全球购买他们的服务，并选择最接近您的地区的服务器位置，以获得更好的性能和体验。'],['可以'],True
{},"Как веб-мастер личного сайта, помимо NPS и FRP, есть ли еще какие-либо инструменты для пробивки внутренней сети, которые можно развернуть на публичном сервере? Перечислите их и дайте краткое описание.","Инструменты для пробивки внутренней сети на публичном сервере
Если вы являетесь веб-мастером личного сайта и ищете инструменты для пробивки внутренней сети, которые можно развернуть на публичном сервере, помимо NPS и FRP, есть несколько других инструментов, которые могут быть полезными. Вот некоторые из них:

NAT-P2P: NAT-P2P (Network
","['Zerotier - это open-source инструмент для пробивки внутренней сети, который использует технологию P2P и позволяет пробивать внутреннюю сеть без общедоступного сервера. Особенности Zerotier включают высокий уровень безопасности, неограниченное количество подключений в бесплатной версии, но требуется установка клиентского ПО на каждом устройстве. Подходит для личного использования или небольших команд.\n\nLanproxy - это инструмент для пробивки внутренней сети, разработанный на языке Go, поддерживает множество протоколов, таких как TCP, UDP и др. Он использует клиент-серверную архитектуру, где сервер развёртывается на общедоступном сервере, а клиент - на устройствах внутренней сети. Lanproxy имеет относительно простые функции, но легок в развёртывании и использовании.\n\nGoproxy - мощный инструмент для пробивки внутренней сети, поддерживает множество протоколов, таких как TCP, UDP, HTTP, HTTPS и др. Он также использует клиент-серверную архитектуру, где сервер развёртывается на общедоступном сервере, а клиент - на устройствах внутренней сети. Goproxy поддерживает различные методы аутентификации и имеет веб-интерфейс для управления.\n\nNgrok - популярный инструмент для пробивки внутренней сети, также использует клиент-серверную архитектуру, где сервер развёртывается на общедоступном сервере, а клиент - на устройствах внутренней сети. Ngrok поддерживает множество протоколов, таких как TCP, HTTP, HTTPS и имеет API для разработки. Однако, бесплатная версия Ngrok имеет ограничения по количеству подключений, поддоменам и др.\n\nHamachi - известный инструмент для пробивки внутренней сети, который поддерживает динамический внешний IP адрес.\n\nCpolar - один из китайских инструментов для пробивки внутренней сети, подходит для сценариев, требующих пробивки внутренней сети.\n\nNATAPP - ещё один инструмент для пробивки внутренней сети, подходит для личного использования.\n\nEw - популярный open-source инструмент для пробивки внутренней сети, отличается высокой производительностью.\n\nSAKURA FRP - ещё один китайский инструмент для пробивки внутренней сети, подходит для различных сетевых сред.']",['Zerotier||Lanproxy||Ngrok||Goproxy'],False
{},vocol-ai-逐字稿筆記神器是什麼-有什麼特點和應用場景,"逐字稿筆記神器 vocol-ai 是什麼？
vocol-ai 是一個逐字稿筆記神器，它使用人工智能技術來自動生成逐字稿筆記。逐字稿筆記是將演講、會議、訪談等語音內容轉錄成文字的過程。vocol-ai 可以幫助用戶快速且準確地生成逐字稿筆記，節省時間和提高效率。
vocol-ai 的特點和應用場景
vocol-ai",['Vocol.ai 是一款強大的 AI 語音協作平台，提供自動逐字稿和摘要功能，幫助使用者快速將會議或對話等語音轉換成文字記錄。以下是 Vocol.ai 的特點和應用場景： 特點： 語言支援：Vocol.ai 支援多種語言，包括中文、英文、日文等。 自然語言模型：採用先進的自然語言模型技術，如 GPT，提供準確的逐字稿和摘要功能。 AI 摘要：自動生成摘要和重點，提供快速閱讀整理資訊的功能。 易用介面：提供直觀易用的平台，方便使用者存取、分享和編輯逐字稿和摘要。 協作功能：支援雲端記錄、評論和劃重點，使與會者可以參與回顧和討論會議內容。 應用場景： 會議記錄：用於轉錄會議內容，製作逐字稿和摘要，方便後續查閱或分享。 學習筆記：學生可以使用 Vocol.ai 製作課堂筆記，製作逐字稿和摘要以供學習和記錄。 團隊協作：在跨國團隊或遠端工作情況下，協助團隊成員快速理解會議內容和進度。 媒體採訪：媒體人可以將採訪內容快速轉錄成文字，方便後續編輯和使用。 教育訓練：在線上課程或教學中使用 Vocol.ai 提供的逐字稿和摘要，幫助學生更好理解內容。 總的來說，Vocol.ai 是一個全方位的逐字稿和摘要工具，適用於各種工作場景和學習需求，提供快速、準確和便利的文字轉錄和整理功能。'],['多語言'],False
{},Скачайте файл ISO 7000 для меня.,"Скачайте файл ISO 7000 для меня
ISO 7000 - это стандарт, который определяет графические символы для использования в технической документации, связанной с продукцией и услугами. Он предоставляет универсальные символы для обозначения различных функций, характеристик и свойств продуктов.
Чтобы скачать файл ISO 7000, вам понадобится","['ISO является международным стандартом, и его можно приобрести через официальные каналы за плату.']",['приобрести||Покупка'],False
{},Knowledge Bases for Amazon Bedrock的自動數據同步功能是指什麼？,Amazon Bedrock的自動數據同步功能是指在Knowledge Bases for Amazon Bedrock中，自動將數據與向量存儲庫同步的功能。Knowledge Bases for Amazon Bedrock是一個完全托管的服務，用於實現檢索增強生成（RAG）工作流程，從數據源到檢索和提示增強，無需構建自定義集,['Knowledge Bases for Amazon Bedrock的自動數據同步功能是Amazon Bedrock的一項功能，它用於自動保持用戶在查詢時使用的知識庫處於最新狀態。當用戶上傳數據源以建立知識庫時，該數據源將定期自動同步，使知識庫反映最新信息。這樣一來，用戶就可以始終使用最新信息來增強根據模型的響應生成。'],"['自動', '知識庫||RAG']",True
{},what are the applications of lidar in aerospace industry?,"Applications of LiDAR in the Aerospace Industry
LiDAR (Light Detection and Ranging) technology has various applications in the aerospace industry. Here are some key applications:


Mapping and Surveying: LiDAR is used to create accurate and detailed maps of both natural and manmade environments. It can be used to produce more precise shoreline maps, create digital elevation models for geographic information systems, and assist in emergency response operations . LiDAR data collected from survey aircraft can provide top-down and side views of various features, aiding in mapping and surveying activities .


Navigation and Obstacle Detection: LiDAR sensors are used in aerospace applications for navigation and obstacle detection. They provide accurate 3D representations of

","['Terrain and Obstacle Mapping: LiDAR can be used to create highly accurate 3D maps of terrain, landscapes, and obstacles. This is useful for mission planning, navigation, and situational awareness in aerospace applications.\nAircraft and Satellite Detection and Tracking: LiDAR can be used to detect and track aircraft, satellites, and space debris with high precision. This aids in airspace management and collision avoidance.\nAirport Operations: LiDAR can provide precise measurements of runway conditions, including detecting foreign object debris (FOD) and runway surface damage. This improves airport safety and efficiency.\nAutonomous Navigation: LiDAR is a key sensor used in the navigation systems of autonomous aerial vehicles like drones, allowing them to detect and avoid obstacles.\nBathymetric Mapping: Military applications of LiDAR include bathymetric mapping, which can precisely image terrain features both on land and in the water, useful for naval operations']",['Terrain and Obstacle Mapping||Aircraft and Satellite Detection and Tracking||Airport Operations||Autonomous Navigation||Bathymetric Mapping'],False
