metadata,question,answer,ground_truths,keywords,passed
{},У Huawei Mate 60 есть функция 5G?,"Да, у Huawei Mate 60 есть функция 5G. Это подтверждается в источниках  и .","['Согласно результатам поиска, смартфоны серии Huawei Mate 60 поддерживают функцию 5G. Несмотря на то, что при выпуске не было явно указано о поддержке 5G, пользовательские тесты и анализ показали, что серия Mate 60 имеет функцию 5G. Фактические тесты показали, что скорость сети Mate 60 Pro приближается или даже превышает 1000 Мбит/с, что значительно превышает 4G-сеть, что указывает на то, что он действительно поддерживает 5G-сеть, хотя в системных настройках может еще не отображаться опция переключения на 5G.']","['поддерживают', '1000']",False
{},"Как проверить, достаточно ли свободного места на памяти и работает ли память нормально на DAQ970A?","Как проверить, достаточно ли свободного места на памяти и работает ли память нормально на DAQ970A?
Для проверки доступного свободного места на памяти и работы памяти на DAQ970A можно воспользоваться следующими методами:

Проверка доступного свободного места на памяти:

Откройте меню на DAQ970A и найдите раздел, связанный


","['1. Можно запросить емкость памяти прибора, отправив команду *MEM?.\n2. Если памяти недостаточно, можно отправить команду *RST для очистки данных в памяти и освобождения большего пространства.']",['MEM'],False
